,Question,Answer
487,Ludwig Boltzmann,    This diagram or relation commonly used in the industry to assess rod life and rod failure for artificial lift applications is named after this English scientist.
488,Goodman,    This mathematical and engineering object is characterized as a geometric object that has a magnitude and direction.
489,    Calculation: I have a reservoir characterized by exponential decline that has a decline rate of -0.01 1/day with an initial production of 5000 barrels/day. The field is currently producing 3000 barrels/day. What is the predicted ultimate recovery?,"200,000 barrels"
490,    Wellbore breakout occurs along the azimuth of which principal stress?,Shmax
491,"    When using an ultrasonic televiewer image, what mathematical shape describes the image of a fracture that slices the wellbore at an angle?","Sinusoid, Sinusoidal"
492,"    When the rate of sediment deposition is greater than the rate of escape of fluids in the reservoir, this will result in a overburden pressure gradient > 1 psi/ft. What type of reservoir is this?",Overpressured
493,    This type of decline curve is characterized by a b-factor of 1.,Harmonic
494,    Calculation: I hold a 2 kg object 5 meters off the ground. How much potential energy does the object have in joules?,100 J
495,    This thermodynamic principle mentioned by Van der Waals indicates that all fluids at the same reduced temperature and pressure have the same compressibility factor and deviate from ideal gas behavior to the same degree.,Principle of corresponding states
496,"    This thermodynamic variable is equal to the pressure of an ideal gas that has the same chemical potential as the real gas. In other words, it becomes equal to the pressure of the fluid at pressures low enough that the fluid approaches ideal gas state.",Fugacity
497,    What is the maximum number of coexisting phases at equilibrium for a pure fluid?,"Three, 3"
498,"    Above ice's melting point, does the specific volume of the substance increase or decrease?",decreases
499,"    This cycle developed by a French engineer demonstrates the most efficient cycle for converting thermal energy into work, or extracting the most work from a given flow of heat between two temperature baths.",Carnot cycle
500,"    If I treat my drilling mud with lignosulfonate,  I likely have this type of problem or issue.",Flocculation
501,    Why would an operator choose to conduct a Methylene blue test on drilling mud?,Determine CEC or bentonite clay content of the mud
502,"    During drilling, if the shale formation has an activity of 0.7 and the shale starts to fracture and I see a reduced mud weight, what is a reasonable value for the activity of the drilling mud?",> 0.7
503,"    An ExxonMobil pipeline carrying oil from the Wabasca oil field in Canada had a leak on March 29, 2013. What is the name of the Arkansas town affected by the spill?","Mayflower, Arkansas"
504,"    What Las Colinas, Dallas based oil company is traded on the NYSE under the symbol “PXD”?",Pioneer Natural Resources
505,    What is the name of the SPE International chapter that New Orleans is a part of?,"SPE Delta Chapter, Delta"
506,    Who is the president of the SPE Delta chapter?,"Paul Morphy III, Shell Offshore, Inc."
507,    What is the name of this New Orleans-based oil company founded in 1984 whose CEO is Mr. J. Luis BaSos?,"ORX Resources, private"
508,    In what year did SPE’s first female president serve and what is her name?,"1998, DeAnn Craig"
509,    Name the last five SPE Presidents (2009-2013),"Roodhart, Fattahi, Labastie, Thakur, Imomoh"
510,"    This Calgary-based oil company became a subsidiary of this Chinese-based oil company on February 25, 2013. Name both companies.","Nexen Energy, CNOOC Energy."
511,    What is the total membership of SPE (professional and students),104762.0
512,"    According to the 2012 BP Statistical Review, name the top 5 Gas Producers in South America from High to Low","Trinidad&Tobago, Argentina, Venezuela, Brazil, Bolivia"
513,"    According to the 2012 BP Statistical Review, what is worldwide oil production?",83.576 MMBO/day
514,"    According to the 2012 BP Statistical Review, what are US natural gas reserves?",300 TCF
515,    You may know Sheikh Khalifa Bin Zayed Al Nahyan as the head of the Supreme Petroleum Council and the head of this major national oil company.,"ADNOC, Abu Dhabi NOC"
516,"    This Canadian-based pipeline and transportation company has been lobbying hard for the Keystone XL pipeline, which would transport heavy oils from Canada oil sands to the Gulf Coast.",TransCanada
517,    What is the price of WTI crude oil?,$92.64/bbl
518,    This former CEO for a well-known Oklahoma-based gas producer was recently voted by shareholders to no longer return to his position and retire.,Aubrey McClendon
519,    This is a Pulitzer Prize winning American author who is the chairman of Cambridge Energy Research Associates. ,Daniel Yergin
520,"    In October 2011, this American energy company bought El Paso Corporation in a 21.2 billion deal that made the company the biggest U.S. Pipeline operator.",Kinder Morgan Inc.
521,    The US Strategic Petroleum Reserve is the largest emergency oil supply in the world with the capacity to hold up to how many million barrels of oil?,727 million
522,"    On a F vs Eo, or total withdrawal vs oil expansion graph, a reservoir will be linear under this condition.","No water influx, no aquifer"
523,"    I am producing a dry gas reservoir and create a P/z plot for the reservoir and extrapolate my data until I hit a cumulative gas estimate of 50 BCF. If I later realize my reservoir is under a natural water drive, will my new cumulative gas estimate be higher or lower than 50 BCF?",Lower
524,    How many isomers does Pentane have?,"Three, 3"
525,"    Regarding phase behavior, this is the point where 3 phases coexist in equilibrium.",Triple Point
526,"    On a phase diagram, this is the term given to a line of highest temperature where a mixture can exist in two phases.",Cricondentherm
527,    Name the two most common elements in the Earth's crust?,"Oxygen, Silicon"
528,    This is the name of a vessel that breaks oil-water emulsions so that oil can be accepted by pipeline or for transport,Heater Treater
529,    This commonly used solids carrier for fracture treatments undergoes frequent price swings as most of the material comes from farms in India.,Guar Gum
530,"    For oil based muds, this is the name of the temperature where oil and rubber, such as rubber in pump parts, will become one phase and is thus designed to avoid.","    Calculation: in psi/ft, what is the pressure gradient for 11 ppm mud? "
531,0.572 psi/ft,    The tensile strength of standard cement is roughly ______ times less than the compressive strength?
532,10-12x,    The main difference between the Driller's Method and the Wait and Weight method of killing a well is?
533,"Number of mud circulations, driller's is 2, W&W is 1.","    In a meeting, someone mentions a C228D model pumping unit. What does the ""228"" stand for?"
534,228K or 228000 in-lbs torque rating on the gear box.,"    Where is the SPE Offshore Technology Conference, or OTC, held every year?"
535,"Houston, Texas","    Concerning geostatistical or other statistical analysis, what relationship do standard deviation and variance have?"
536,SD = sqrt(variance) or Variance = SD^2,    Who is the CEO for Petrobras?
537,Maria das Gracas Foster,"    In 1923, this Texas company developed the industry's first enclosed, geared pumping unit."
538,Lufkin,"    In 2007, two countries joined OPEC and are its newest members. Name one."
539,"Angola, Ecuador.",    What is the equation for the minimum porosity in a dispersed shale?
540,Porosity = sand porosity * shale porosity,"    This is the name where molecules of natural gas, usually methane, are trapped in ice molecules."
541,"Methane Hydrate, Clathrate","    This is a device run during drilling with a smaller initial outside diameter that expands to seal the wellbore. They often use flexible, elastic elements to expand."
542,Packers,"    Calculation: What is the NPV of receiving $500,000 in 5 years with a discount factor of 10%. Assume no costs."
543,"    On J55 casing, what does the ""55"" stand for?","55,000 psi minimum yield strength"
544,    What year was the first petrobowl held and who won it?,"2002, Texas Tech"
545,What is the only school to have won petrobowl 3 times?,OU
546,What type of faulting regime has Sv at its largest principal stress and Shmin as the smallest?,Normal
547,What is the name of the commonly used correlation to estimate fracture pressure?,Eaton's Correlation
548,A marsh funnel is used on a rig to determine this.,Viscosity
549,What equation represents Boyle's Law?,PV1 = PV2.
550,"This company received the first post-moratorium drilling permit in the Gulf of Mexico on February 28, 2011.",Noble Energy
551,"With an estimated recoverable 9 billion bbls of recoverable oil, this Chevron-operated field is located in Kazakhstan. This field is also one of the deepest onshore producing fields, what is its name?",Tengiz
552,"The derrick received its name from Thomas Derrick, a 17th century Englishman that invented a system of ropes and pulleys for his occupation that would later become the inspiration for a drilling derrick. What is his occupation?","Executioner, Hangman"
553,At what level or percentage of sulfur content is crude oil considered to be sour crude oil?,0.0050
554,"Name the process of physical, chemical, or biological alteration of sediments during or after they have been deposited.",Diagenesis
555,What percentage of SPE membership is comprised of students?,0.29
556,"This Cajun-inspised term is used to describe the soft and sticky formation encountered when drilling that plugs up drilling tools, piping, and shale shaker screens.",Gumbo
557,This material is a solid that begins to form on catalysts used on cracking processes and refineries.,Coke
558,"In what decade was the first horizontal well drilled in Texon, Texas?",1920s (1929)
559,"Name 4 components of an ESP, or electric submersible pump.","Rotor, stator, motor, diffuser, impeller"
560,"In May 2012, this US state became the first to ban hydraulic fracturing, or fracing.",Vermont
561,Name the year the petroleum branch of AIME became a full-fledged professional society that would become SPE.,1957.0
562,Name the country that is the world's leading LNG exporter that has received recent publicity for hosting the 2022 FIFA world cup.,Qatar
563,Name the first European country to ban the use of hydraulic fracturing.,France
564,Name the first place winner of the 2011 International student paper contest held at the undergraduate division.,Parag Bandyopadhyay
565,What is the name for the chemical that is frequently used to alter mud pH levels while drilling.,Lime
566,This sand from St. Peters sandstone is used as proppant in hydraulic fracturing in the USA and gets its name from this city in Illinois. Name the city.,Ottawa
567,"This class of cement, according to API, is intended for use at depths of 10000",14000 feet at high temperatures and pressures. Name the class.
568,"In the US, under what flow is an oil or gas well classified as a stripper well? (oil and gas rate)","60 MCF, 10 BBL/day"
569,Compaction drive is defined as the expulsion of fluids due to the dynamic reduction of what reservoir property?,Porosity
570,"When a source rock is examined under a reflectance microscope, the amount of light reflected by this plant organic matter helps define the maturity of the source rock. Name this organic matter.",Vitrinite
571,Name 2 components of a traditional pumping unit.,"Etc, etc"
572,"What was the original name of the NYMEX, the world's largest physical commodity exchange, where billions of dollars in energy products and metal are bought and sold every day?",The Butter and Cheese Exchange
573,"What country is the number one source of U.S. oil imports, providing around 25% of US oil imports.",Canada
574,What former scientist became the first world leader to give a major policy speech on climate change in 1988?,Margaret Thatcher
575,How many times has UT won Petrobowl?,"twice, 2x"
576,Carbonate sedimentary rock composed of mostly calcite is what,limestone
577,What equation relates capillary pressure to interfacial tension?,Young-LaPlace
578,Identify the aspect of logging that employs an electrical cable to lower tools into the borehole and is distinct from measurements while drilling and well logging,Wireline
579,"In the early 1800s, saltmakers frequently hit oil or gas in their drilling. These byproducts were considered a nuisance. In this state, so much oil was diverted to the Kanawha River by salt manufacturers that it was known as ""Old Greasy"" to boatmen.",West Virginia
580,This company is publically traded under both the Toronto Stock Exchange and the New York Stock Exchange with a ticker of TSX,TransCanada
581,"The underground process of ""diagenetic override"" leads to a reservoir characterized as?",tight
582,The world's first attempt at a long-distance pipeline would successfully connect the Oil Regions with the Pennsylvania and Reading Railroad. What name was this pipeline given?,Tidewater Pipeline
583,"On October 6, 1957, the first Board of Directors meeting was held in Dallas, Texas, with President John H. Hammond presiding. To what organization did this meeting belong to?",The Society of Petroleum Engineers - of AIME
584,"On March 31, 2012, this oil rig owned by Shell ran aground off the coast of Alaska.",The Kulluk
585,What 3 states account for over half of all domestic refining capacity?,"Texas, Louisiana, California"
586,"The Texas Company, started by Joseph Cullinan, would change its name in 1906 to?",Texaco
587,Type 3 kerogens usually form from what type of organic material and tend to produce what type of hydrovcarbons?,"terrestrial plant material, natural gas"
588,"A joint of C75 casing has the following characteristics: an OD of 4.5 inches, an ID of 3.92 in, 13.5 lbs/ft. Calculate wall thickness, and minimum yield strength, in PSI of this casing.",.29 and 1575000 psi
589,"This diagram can be used to determine the overall, vapor phase, and liquid phase compositions of 3 separate components at one temperature and pressure.",Ternary Diagram
590,This isotherm is required in the modeling of coalbed methane production. It represents the amount of material bound at the surface as a function of the material present in the solution.,Sorption or adsorption
591,A multiphase-fluid flow regime characterized by a series of liquid plugs seperated by relatively large gas pockets.,slug flow
592,"The coefficient of isothermal compressibility has the unit of inverse psi, more commonly known as what in the industry?",sip
593,An important area for Gazprom because it produces 95% of Russia's Natural Gas. Name this region that is often associated with tundra.,Siberia
594,This ULCC supertanker held the record of longest ship ever built and largest capacity of any ship. Give just one of her names.,"Seawise Giant, Happy Giant, Jahre Viking, Knock Nevis"
595,What important additive addition could be made to a Portland cementation to improve its high-pressure / high-temperature (HPHT) stability   ,Sand/Silica Flour
596,A laboratory device used to measure the way in which a slurry flows in response to applied forces.,rheometer
597,The color of petroleum is determined largely by what two components?,Resins and Asphaltenes
598,This refined product is publically traded through the NYMEX with the trading symbol of RB,reformulated gasoline blendstock for oxygen blending
599,"Before allowing futures trading of Oil & Gas, NYMEX was well known for it's futures trading on what crop?",Potato
600,"When a material is compressed in one diection, it usually tends to expand in the other two directions perpendicular to the direction of compression. This phenomenon is called the",Poisson effect
601,The act of drilling with the mud pressure greater than the formation pressure is known as,Overbalanced Drilling
602,Above what Reynolds number does flow in a porous medium become non-Darcy flow?,Order of 1
603,A Naval Petroleum Reserve is an area with probable or poven oil reserves in the U.S. that was widthdrawn from oil exploration by Congress in 1923 for defense purposes. Name two locations of such reserves.,"North Slope of Alaska, Elk Hills and Buena Vista, CA, Teapot Dome, Wyoming"
604,A positive displacement motor that is used in drilling a deviated hole that has more than one angular deflection point in the motor housing.,multibend motor
605,"This instrument determines the amount of oil, water, and solids in drilling mud.",Mud Retort
606,What are the 3 data transmission methods used for MWD?,"Mud pulse telemetry, Electromagnetic telemetry, Wired Drill Pipe"
607,This modern day company began as The Ohio Oil Company in 1887 before being bought by Standard Oil in 1889 and later by United States Steel in 1982.,Marathon Oil Company
608,Calculate the mass of methane gas contained at 1000 psia and 68F in a cylinder with volume of 3.2 ft3. Assume that methane is an ideal gas.,m=9.1 lb
609,Turbidite deposits would most likely be found in which systems tract of the classic sequence stratigraphic model?,lowstand systems tract
610,A procedure for calibration of permeability data obtained from a minipermeameter device. This is usually done when the pore space approaches the mean free path of the gas.,Klinkenberg Correction
611,"This man used the phrase “the Great Game”— the struggle to accomplish and build, and the drive to make money, both for its own sake and as a register of achievement. Who was he?",John D. Rockefeller
612,"If the size of the grains of a beadpack were double, how much would the permeability change (all else being equal)?",It would be 4 times larger
613,"In the subsurface, is the total compressibility of a dry steam reservoir (single phase, no liquid water present) higher, lower, or about the same as a saturated (two-phase steam and water) reservoir at the same pressure?",It is much lower. 
614,A semi-log plot produced during pressure buildup analysis is known as,Horner plot
615,This French engineer was working as the Inspector General of Bridges and Highways in Paris when he modified the Prony Equation into the well-known form we use today.,Henry Darcy
616,a sweet-tasting synthetic ingredient used in toothpaste and other products -- is a petrochemical derived from oil.,Glycerin
617,"Name the two largest conventional oil fields in the world, and their location",Ghawar Field in Saudi Arabia and Burgan Field in Kuwait
618,"In a normal faulting regime (with isotropic horizontal stress), which of the following faults is more likely to slip in response to an increase in pressure?  Vertical fault, fault dipping 60 degrees, fault dipping 45 degrees?",Fault dipping 60 degrees
619,"Name 3 of the mainland central american countries with no proven reserves of crude oil, as of Jan 1st, 2011.","El Salvador, Honduras, Costa Rica, Panama"
620,"Arrange the following minerals in order from densest to lease dense: quartz, dolomite, calcite","dolomite, calcite, quartz"
621,"This SPE award is given to outstanding faculty of Petroleum Engineering and has been awarded to such Professors as Dr. Sharma, Dr. Pope, Dr. Caudle, and Dr. Lake.",Distinguished Achievement Award for Petroleum Engineering Faculty
622,Determine the number of barrels of water weighing 8 ppg required to reduce 100 bbl of 14 ppg mud to 12 ppg mud,~54.5 bbl
623,"Home to some of the world's largest recent oil discoveries, Brazil is an important Latin American power. Name the President of Brazil.",Dilma Rousseff
624,Soft sediment deformation is most typical in which facies of deltaic deposits?,delta front facies
625,What is the D/t (“D over t ratio”) in casing design and how does it affect it?,D/t stand for casing diameter over wall thickness and affects  burst and collapse design
626,A water pump and a steam compressor operate with the same inlet pressure and outlet pressure at the same mass flow rate. Which one require greater power input?,Compressor
627,This physical characteristic is the temperature at which wax begins to solidify and is identified by the onset of turbidity as the temperature is lowered,Cloud Point
628,What is the name given for the 1D water flood problem that has an analytical solution?,Bulkley-Leverett
629,List two common types of pressure transient analysis?,Buildup and drawdown tests
630,This type of motion is the presumably random moving of particles suspended in a fluid (liquid or gas) resulting from their bombardment by the fast-moving atoms in the gas or liquid.,Brownian Motion
631,Uncontrolled discharge of formation fluid out of the wellbore is known as,Blowout
632,"The equation that relates chemical reaction rates to the temperature and includes such terms as Activation Energy, Temperature, and the universal gas constant.",Arrhenius Equation
633,Name the first well surveying tool to be used,Acid Bottle
634,What is a semiveriogram?,A statistical tool that measures the spatial correlation or continuity in geophysical data
635,One bbl of oil accounts for approximately how many gallons of diesel fuel?,9.21 gallons
636,What is the approximate pressure at the bottom of an open tank 10 ft in height and 2 ft in diameter that contains water at STP?,4.33 psia
637,"In petrophysics, what is Stone's model used to predict?",3-phase relative permeability
638,What is the standard length of drill pipe?,30 Ft
639,The US has approximately how many miles of oil pipelines within its borders?,"200,000 miles"
640,Laboratory analysis of a typical black oil will indicate an initial oil formation volume factor of,2.0 res bbl/STB
641,"If pore diameter in a rock is reduced by half, how much does the capillary entry pressure increase according to the Washburn equation?",2 times
642,"Flowrate of a 1 cP fluid in a 1 m pipe is 1 cm3/s at a pressure drop of 10 psi. If the radius is doubled, what is the new flowrate?",16 m3/s
643,This temperature window allows for the creation of crude oil from organic matter in sedimentary rocks. What are these values?,150-300F
