,Question,Answer
270," In 1995, who was named President, chairman and CEO of Halliburton?   ", Dick Cheney  
271, Where is Weatherford International’s headquarters located?   ," Houston, Texas  "
272, What year was the first offshore oil platform built?   ,1938.0
273, What company constructed the first offshore oil platform?   , Superior Oil 
274, What oil company owns the largest oil platform?   , Petrobras  
275, What was the date of the highest price of oil per barrel occur?   ,39630.0
276, What is the name of the Schlumberger researcher that developed of the SP log?   , Henri Doll  
277, What company introduced the gamma ray log?   , Well Surveys Inc.   
278, Which country’s flag is below?       , Saudi Arabia      
279, Which country’s flag is below?    , Iraq   
280, Which country’s flag is below?       , Iran   
281, Which country’s flag is below?      , Qatar    
282, Which country’s flag is below?      , Venezuela   
283, Which country’s flag is below?     , Kuwait   
284, Which country’s flag is below?     , Algeria     
285, Which country’s flag is below?      , Angola   
286, Which country’s flag is below?      , Nigeria   
287, Which country’s flag is below?      , Libya      
288, Which country’s flag is below?      , united Arab Emirates   
289, What is the capital of Saudi Arabia?    , Riyadh   
290, What is the capital of Iraq?    , Baghdad   
291, What is the capital of Iran?    , Tehran   
292, What is the capital of Angola?    , Luanda   
293, What is the capital of Algeria?    , Algiers   
294, What is the capital of United Arab Emirates?    , Dubai   
295, What is the capital of Venezuela?    , Caracas   
296, What is the capital of Qatar?    , Doha   
297,  What is the capital of Ecuador?    ,  Quito   
298, What is the capital of Libya?    , Tripoli   
299, What is the capital of Nigeria?    , Abuja
300,What year did Saudi and Aramco come to a 50/50 Deal?,1950.0
301,What did Enrico Mattei do in the 1930s?  , Manager at a chemical plant  
302,Who introduced Alfonzo and Tariki?  , Wanda Jablonski  
303,What was the name of the precursor agreement to the formation of OPEC? What five countries were involved?  ," Gentlemen’s Agreement. Iran, Iraq, Venezuela, Saudi Arabia, Kuwait  "
304,Where did the Japanese consortium Arabian oil get their concession?  , Offshore Neutral Zone  
305,What American company broke the 50/50 agreement in Iran after ENI?  , Standard Oil of Indiana    
306,What was the Brownsville U-Turn?  , Mexico had no pipelines so they shipped oil to Brownsville and then drove it across the border and then back to the U.S. to take an advantage of tariff breaks for overland shipped oil  
307,Who replaced Tariki as the Saudi Oil minister?  Anwer: Ahmed Zaki Yamani  ,Name the five original countries in OPEC.  
308," Iran, Iraq, Venezuela, Saudi Arabia, Kuwait  ",How did Enrico Mattei die?  
309, Plane crash with the Time Magazine Rome Bureau chief  ,When did Standard Oil antitrust break up?  
310,1911.0,What did Standard of Oil of New York turn into?  
311, SOCONOY  Mobil Exxon Mobil  ,Who made up ARAMCO?  
312," Jersey, SOCONY, Texaco, and Standard Oil of California   ",Who was Anglo-Iranian’s CEO?  
313, Sir William Fraser  ,How did the Shah come to power?  
314, Allies put him in place of his Nazi-sympathizing dad  ,Who was the leader of Operation AJAX?  
315, Kermit Roosevelt  ,What ends up happening to the Justice department’s antitrust case?  
316," Downstream only affected, STANVAC pulled apart.  ",What year did the oil lift take place?  
317,1956.0,Who was the leader of Egypt who nationalized the Suez?  
318, Gamal Abdel Nasser   ,Who built the Suez Canal?  
319, Ferdinand de Lesseps   ,When was the Suez Canal finished?  
320,1869.0,Name the oil man who drilled the first well in the United States.  
321, Colonell Drake   ,Where and when was the first well drilled in the United States?  
322," Titusville, Pennsylvania, 1859   ",How deep was the first well drilled in the United States?  
323, 69 ft deep   ,Name the promoter who organized an investor group for Silliman’s study of “Rock Oil.”  
324, George Bissel   ,Who invented and patented “Kerosene?”  
325, Abraham Gesner   ,When and where the first flowing well was drilled in the United States?  
326," On 1861, at the rate of 3000 bbl/day in the Western Pennsylvania ", When was the peak oil production in Western Pennsylvania and what was the production rate?  
327," 1862, 3 million bbl/day   ","When, where and for what price did John Rockefeller buy his first refinery? "
328," 1865, Cleveland, Ohio. Rockefeller won in private auction one of the city’s biggest oil refineries for $72,500 against Maurice Clark  ",Who owned the world’s largest refinery at the end of the 1860s?  
329, J.D. Rockefeller   ,Name the closest partner of John Rockefeller who run oil transportation arrangements as well as founded Miami and Palm Beach and developed the state of Florida?  
330, Henry Flagler   ,When and where was Standard Oil founded?  
331," Founded in 1870, by five men led by Rockefeller on 26 Broadway, NYC   ",Name the world’s first long distance pipeline and the date it was built.  
332," Tidewater, 1879   ",Name the sulfur rich oil field discovered at the mid of 1880s which soon gave one third of American oil production?  
333," Lima-Indiana field, Ohio state   ",Nowadays majority of oil companies are vertically integrated. Name the person who founded this type of corporate management?  
334, John Rockefeller  ,When was the first well drilled in Baku?  
335, 1871/1872   ,"Later this person was called oil king of Baku, this person who established Nobel’s Brother’s Petroleum Company. Who was he?  "
336, Ludwig Nobel   ,When did the Russian oil production reach 4/5 of the US production and how much was it?  
337," 1886, 23 million bbl/day   ",Name the company of jewish family and the date it was established  
338," BNITO, 1886 (Caspian and Black Sea Petroleum Company)   ","Which company established a new branch in Britain 24 days after BNITO, also give the name of the company.  "
339," 1888 – Standard Oil established its first foreign affiliate – Anglo-American Company 24 days after the Rothschilds, becoming true Multinational enterprise   ",Describe the revolutionary trip of Marcus Samuel.  
340," 1892- Marcus Samuel’s Coupe: Murex – Marus Samuel’s tanker sailed from West Hartlepool to Batum in Caspian region, where it was filled with BNITO’s kerosene, then went to Singapore and later arrived to final destination—Bangkok   ",When was Royal Dutch created? Who created it?  
341, 1890 – Royal Dutch company was established by Aeilko Jans Zijlker  ,When did Edison invent incandescent light bulb?  
342,1878.0,"According to The Prize, give the years of the Kerosene Age.  "
343, 1859-1900   ,When and where was the first start of Californian oil boom?  
344," 1870s – oil boom in Ventura County and in San Fernando Valley, North of Los Angeles   ",Give the correct order of leading producer states from 1859 to 1
345," Pennsylvania, California, Oklahoma, Texas  ",Which company in California was the dominant producer before Socal?  
346, Union Oil of Califonia   ,When was SOcal founded?  
347,1907.0,When and where was Rotary Drilling technique first pioneered and used?  
348," 1900—Corsicana, TX used in Spindletop   ",By what event was Texas Oil Boom started and when was it?  
349," Well Lucas 1 – Spindletop gusher ( 75,000 bbl/day) in 1901   ",Give the year of the start of the Oklahoma oil boom.  
350,1901.0,Which oil field in OK made the state a leading oil producer?  
351," Glen Pool, Tulsa, Oklahoma   ",When and by whom Gulf Oil was founded?  
352, 1907 by Mellons   ,"This person was a pioneer of the Texan oil industry byy founding a new oil company. Name the person,  his company and the date it was founded.  "
353," Joseph (Buckskin Joe) Cullinan, an aggressive Texas oil developer, Texaco, 1906   ",Name the date of Rockefeller’s retirement and his successor.  
354," 1897, John D. Archibold  ","Name the author and date of publication of the book, The History of Standard Oil Company.  "
355," Ida Tarbell, 1904   ",Name the president who caused Standard’s break up and his year of election.  
356, Theodore Roosevelt   ,When did Standard oil break up? Name the companies it formed.  
357, 1911  Standard Oil of New Jersey – Exxon  Standard Oil of New York – Mobil  Standard Oil of California – Chevron  Standard Oil of Ohio –Sohio  Standard Oil of Indiana – Amoco  Continental Oil – Conoco  Atlantic   ,When did the first gusher start in Borneo and what was it called?  
358," 1898, called Black Spot, oil was unsuitable for kerosene, but good for fuel oil ","This person was called “Napoleon of Oil,” he also led a new combination of two companies – competitors of Standard, name him and the combination he led.  "
359," Henri Deterding, “British Dutch”   ","Name the company, created by Rothschilds at the beginning of 20th century.  "
360, Asiatic Petroleum Company    ,"When and how was Royal Dutch Shell Group formed, its primary share holders?  "
361," 1907 – Royal Dutch/Shell Group (RDSG) was created by purchase of Royal Dutch 25% shares of Shell. Royal Dutch and Shell became holding companies, with the former holding 60% of the stock in the operating subsidiaries and the latter 40%   ",When and how RDSG became an important player in Russia?  
362," 1912 – the Rothschilds sold their interests to RDSG, instantly making it a major economic force in Russia, with 20% control of its total oil production   ",Who formed the European Petroleum Union?  
363," Nobels, Rothschilds, Deutsche Bank   ",When was the European Petroleum Union formed?  
364,1906.0,Name the Persian diplomat who made important connections to develop Persian oil industry.  
365, Antonie Kitabgi  ,"This person made a very important contribution to Persian oil industry, organized first drilling operations and led the British Concession syndicate to develop oil industry in Persia. Who is this person?  "
366, Knox D’Arcy   ,Name the location and date of the first gusher in Persia.  
367, Neutral Zone in 1908  ,Give the name of the reorganized name of the British Concession.  
368, Anglo-Persian Oil Company (APOC)   ,Which company in England started the Persian oil industry development by investing on D’Arcy’s operations in Persia?  
369, Burmah Oil in 1904   ,What did Churchill learn about oil from Frisher?  
370," it does not deteriorate    It can be stored up in vast, defensible tanks    that which was east of Suez was cheaper than coal   ",When Churchill agreed to convert entire navy to oil?  
371,1912.0,"In an effort to integrate, Anglo-Persian purchased one of the largest pipeline networks in the United Kingdom. What was the name of the company that owned the pipeline?  "
372, British Petroleum   ,"Used as an essential ingredient for TNT, it was generated from coal until able to extract from Shell’s Borneo crude. What wast his ingredient?  "
373, Toluol ,"Of the many tankers sunk by German submarines in WWI, give the name of one lost by Standard Oil of New Jersey and Shell.  "
374, Standard Oil of New Jersey lost the John D. Archibold and Shell Lost the Murex   ,Within 5 % give the percentage of petroleum supplied by the United States to Allied Forces in WWI.  
375,0.8,State the purpose and chairman of the National Petroleum War Service Committee during WWI.  
376," It pooled the American oil supplies for Europe. Alfred Bedford, president of Standard Oil of New Jersey   ",The “golden lane” is located in which country?  
377, Mexico   ,"Located in Venezuela, what region led to the country’s oil boom?  "
378, Lake Maracaibo Basin   ,"The barroso well owned by Shell in the Lake Maracaibo Basin started the Venezuelan boom, what was its initial production rate and what was the name of the field?  "
379," ~100,000 bbls/day and La Rosa Field   ",What type of drilling method brought Jersey off the sidelines and into the game in 1928?  
380, Underwater Drilling   ,What was the name of the field that brought the boom to East Texas?  
381, The Black Giant  ,Name the well in 1930 that brought attention to the Black Giant and its initial production.  
382," Daisy Bradford # 3, 340,000 bbl/day   ",This entity was called in to stop the over-production in the Texas fields.  
383, Texas Railroad Commission   ,This contraband oil became the problem with getting the oil industry back to stability by undercutting the already low prices.  
384, Hot Oil   ,Name the agreement between states that helped stabilize the industry by voluntary quotas.  
385, Interstate Oil Compact   ,How many barrels of oil did Japan accidentally destroy during the bombing of Pearl Harbor?  
386, 4.5 million bbl   ,"Before WWII, who were the three largest oil companies in Aisia?  "
387," Rising Sun, Standard Vacuum, Japanese Affiliates of Royal Dutch Company   ",Who was Japan’s largest importer of petroleum before WWII?  
388, United States of America   ,Name 2 of the 3 powers the “Petroleum Industry Act” of 1934 gave to the United States government?  
389," Set Market Quotas, Fix Prices, Control imports/exports of petroleum   ",What grade of oil did the United States ban from exports to Japan with the “National Defense Act?”  
390, Aviation Fuel (87+)   ,What was I.G. Farben?  
391, Largest German synthetic fuel chemical company   ,Who is Friederich Bergius?  
392, First man to successfully extract liquid from coal   ,Who is Walter Teagle?  
393, President of Standard Oil of New Jersey (1926)   ,Who was Frank Howard?  
394, Head of Research for Standard Oil of New Jersey in 1926   ,What was Carl Bosch?  
395, Chairman of I.G. Farben   ,Who was Albert Speer?  
396, Minister of Armament and War Production.   ,What is hydrogenation?  
397, the process of extracting liquid from coal.   ,"At the start of WWII, which company lead Germany’s synthetic fuel industry?  "
398, I.G. Farben        , In which American state did Standard Oil of New Jersey build a hydrogenation plant?     
399, Louisiana ," Before the beginning of WWII, what percentage of Germany’s total energy imports did the United States account for?     "
400,0.9, Name the three main Caucasian Oil fields Hitler desired.     
401," Baku, Maikop, Grzony    ", Which oil field did Japan capture apart from Hawaii?     
402, Borneo    , In 1945 which country invaded Manchuria?     
403, Soviet Union    , When Did Japan run out of oil completely?     
404,1944.0, What did the Japanese call the oil rich region in which Borneo and Sumaria are located?     
405, The Southern Zone  ," In 1943, what was the name of the largest oil field between California and the Middle East?    "
406, Minas   , What oil field was Japan’s only wildcat well drilled during WWII?    
407, Minas   , H.C. Jansen desired to create a great oil center in the south pacific. What country did he want to place it?    
408, Borneo   , Who pioneered the development of the seismograph?    
409, Everette Lee DeGolyer  ," To within 5%, what percentage of oil used by the Allies in WWII was produced by the United States?   "
410,0.9, Everette DeGolyer was the first American to estimate the oil reserves in the Middle East. How much were the reserves that DeGoyler estimate?   
411,25.0, The California-Arabian Standard Oil Company (CASOC) was the partnership between which two American oil companies?   
412, Socal and Texaco    ," Signed on August 8, 1944, the Anglo-American Petroleum Agreement was collaboration between the U.S. and Britain to establish the 8-member International Petroleum Commission. What were the two primary duties of the Commission? "
413, Prepare estimates of global oil demand and allocate suggested production quotas to various countries  , Name four of the six members of the Iraq Petroleum Company in 1946? 
414," Jersey, Socony, Shell, Anglo-Iranian, CFP, Participants & Investments  "," In 1947, Aramco merged with Jersey and Socony. What percentage of the company did each new partner receive?   "
415," Jersey – 30%, Socony – 10%  ", What agreement in the original Iranian Petroleum Company contract was the major stumbling block to the Aramco merger with Jersey and Socony?   
416, The Red Line Agreement  , Which two companies had a unique purchase-and-sale agreement to get Kuwaiti oil to European markets?   
417, Gulf and Dutch/Shell Group   ," In 1947, which company was the first to successfully drill for oil in the offshore Gulf of Mexico?   "
418, Kerr-McGee  ," In 1947, Los Angelese was hooked up by large-diameter pipe to the gas fields of New Mexico and West Texas. What was the name of this pipeline, and who was its owner?   "
419, Biggest Inch; El Paso Natural gas  ,The first successful well in the Neutral Zone was drilled in March 1953. Who originally identified the geologic structure where the well was drilled?
420, Paul Walton  ," The Saudi Arabian Neutral Zone concession was won in 1948 for $9.5 million upfront, a guaranteed $1 million/year and 55¢/bbl royalty. What company won this concession and who was the company’s owner?   "
421," Pacific Western, J.P. Getty  "," In 1947, Aminoil, a consortium including Phillips, Ashland, and Sinclair, won the concession to which Middle East oil field for $7.5 million in cash, minimum $625,000/year royalty and 15% of the profits?   "
422, Kuwait Neutral Zone concession   ,Which country was the first to adopt the 50/50 principle?   
423, Venezuela  ," During the 1950s, three other countries reworked their concession agreements to include the 50/50 principle. Name these three countries.   "
424," Saudi Arabia, Kuwait, Iraq  ", What program was initiated in late 1956 to address limited oil supply to Western Europe during the Suez crisis?   
425, Oil Lift  , Which country seized control of the Suez Canal in July 1956 starting the Suez Crisis?   
426, Egypt  , Which oil industry technical improvement was a direct result of the Suez Crisis?   
427, Super-Tankers  ," In September 1954, an agreement was signed between a new consortium of nine Western companies and the National Iranian Oil Company. Name these nine companies. "
428," Anglo-Iranian, Jersey, Socony, Texaco, Standard Oil of California, Gulf, Shell, CFP, and Iricon   ", When did the Iranian government pass a resolution to nationalize their oil industry?    
429, March 1951  , Who was the Iranian Prime Minister who had to be deposed before an agreement between Anglo-Iranian and the NIOC would be reached because of his bitter hatred of Anglo-Iranian?   
430, Mohammed Mossadegh (Old Mossy)  , Name the seven sisters. 
431," Jersey, Socony-Vacuum, Standard Oil of California, Texaco, Gulf, Royal Dutch-Shell, BP  "," Following the Italian’s agreement with the National Iranian Oil Company in which Iran received 75% of the profits, which two other companies made agreements with Middle Eastern countries that did not follow the standard 50/50 principle.   "
432, Arabian Oil Company & Standard of Indiana  ," The Gentleman’s Agreement, signed during the 1959 Arab Oil Congress, is seen as the beginning of the alliance that would develop into OPEC. Name the five countries present at this preliminary meeting.   "
433," Venezuela, Saudi Arabia, Kuwait, Iran and Iraq   ", Who are the five founding countries of OPEC?   
434," Saudi Arabia, Venezuela, Iraq, Iran, Kuwait  ", Significant oil deposits were discovered in four African countries during the 1950s. Name these four countries.   
435," Gabon, Algeria, Nigeria, Libya  ", Which company hit big at Zelten in Libya in April 1959?   
436, Jersey  ," The Mandatory Oil Import Program put into effect on March 10, 1959, restricted oil imports to the United States to what percentage of consumption?   "
437,0.09," Continental Oil Company, later Conoco, formed as a result of a merger between which two companies in 1929? "
438," Rocky Mountain Marketing Company, OK-based Crude Producer and Refiner ",Henry Darcy began his work on fluid fluid flow while designing the fountains of this French city?
439,"Dijon, 1856","The Forties pipeline needed to be shut in on August 1, 2011 to fix what problem?"
440,Removing a nearby unexploded WWII mine,Chevron and Gulf Oil Merged when?
441,1984.0,"When the standard trust broke up in 1911, what was the Chevron Branch called"
442,Socal,Where is Saudi Aramco headquartered
443,"Dhahran, Saudi Arabia",Largest oil field in the world?
444,Ghawar Field,What company was first granted concessions in Saudi Arabia?
445,SOCAL,Royal Dutch Shell's HQ?
446,"The Hague, Netherlands",When was the tricone bit invented?
447,1933.0,      What year did NYMEX start trading oil futures?
448,30376.0,      Who arranged the meeting of Juan Pablo Alfonzo and Abdullah Tariki at the 1959 Cairo Oil Congress?
449,Wanda Jablonski,      This is the term for a section of earth raised between two faults.
450,Horst,      This term or unit represents the hydrogen-ion concentration in a substance.
451,pH,"      What country was the first to start a ""50-50"" agreement between a foreign operator and the national government?"
452,Venezuela,      This is the name of a contract signed in July 1928 between several major oil companies (including Royal Dutch and Anglo-Persian) and  that created a oil cartel in ex-Ottoman Empire territory.
453,Red Line Agreement,      This commonly used temperature scale in the industry named after a Scottish engineer has absolute zero set at 0 degrees while using Fahrenheit as its incremental degree.
454,Rankine,      This term describes the apparent weight loss of an object immersed in fluid.
455,Buoyancy,      Name two assumptions for Lame's equation.
456,"Linearly elastic, homogenous, isotropic, and 2-D",    This is constant when experiencing a Joule-Thompson effect.
457,Enthalpy,"    This well log makes a record of the borehole diameter, which is usually constantly changing."
458,Caliper Log,    This is a type of sedimentary rock similar to limestone but rich in magnesium carbonate. It can also be a reservoir rock for petroleum sources.
459,Dolomite or CaMg(CO3)2,    This is the name for a wellbore completion that enables production from two separate zones.
460,Dual Completion,    This is the most common form of Artificial Lift used for offshore purposes.
461,Gas Lift,    This is the name for the classification system used for carbonate sedimentary rocks developed in 1946.
462,"Dunham classification, Robert J. Dunham",    Name the 6 types of reservoirs by the type of fluid produced.
463,"Dead(Heavy) Oil, Black Oil, Volatile Oil, RCG, Wet Gas, Dry Gas",    ExxonMobil drilled the deepest producing oil well in the world in Russia. What is the name of the oilfield and how deep is it in feet?
464,"Chayvo, 40604 feet",    What is the current US rig count?
465,1754 rigs,"    Who believed the Middle East to be the ""greatest prize in history"" due to its oil reservoirs, and the inspiration for Daniel Yergin's book The Prize?"
466,Everett Lee DeGolyer,    This German company conducted research on synthetic fuels for Germany's war effort during WWII.
467,I.G. Farben,    This is the name given to permanently frozen soil or earth that can often cause problems for industry operations.
468,Permafrost,    Oil and Gas are considered to be organic because they have this.
469,Carbon,    What event was most responsible for the increased in oil prices in 1974?
470,Arab Oil Embargo,"    The functional segments Exploration and Production, or E&P, can also be referred to by this one word commonly used in the industry."
471,Upstream,     Drilled solids in mud act to increase what two characteristics of the mud?
472,Density and Viscosity,"    On a drilling rig, the fast line and the static line through the blocks have the same force only in this situation concerning the drilling blocks."
473,Blocks are stationary,    Name a common reservoir production model that can be used below the bubble point of the reservoir.
474,Vogel's Equation,    This is a clay commonly used in salt water applications that is a fiber-like clay that builds viscosity with agitation
475,Attapulgite,    What is the recommended pressure (psi) used for a standard API filtration test?
476,100 psi,    Name two positive displacement pumps.
477,PCP and Beam Lift (Rod Pump),"    If a lower permeability sand was present at the same depth, would the water saturation in that sand be higher, lower or the same as in Sand A?"
478,higher,    Calculation: The capillary pressure for Sand A is measured to be 10 psi at a Sw of 0.4. The density of water is 62 lbm/ft3 and the density of oil is 50 lb/ft3. At what height above the water table is the water saturation going to be 0.4.
479,120 Ft,"    Name 2 types of well tests I can conduct to construct an Inflow Performance Relation, or IPR."
480,"Flowing Test, Gas Lift, Swab, Jet, Pump Assisted Test","    When someone mentions a 2:1 clay mineral such as smectite, what do the ""2"" and the ""1"" represent."
481,"2 is number of tetrahedral sheets, 1 is number of octahedral sheets","    Calculation: The permeability of two rocks is measured to be 1 md and 144 md respectively. If the average pore size of the high permeability rock is 24 microns, estimate the average pore size of the lower permeability rock (porosity is constant)"
482,2 microns,"    As the number of rotor and stator lobes increases (i.e. 9:10 compared to a 3:4), what happens to torque and rotational speed?"
483,"Torque goes up, Speed goes down.",    A gear box on a beam pump reduces these two things.
484,"Torque, speed",    A water-wet solid surface is characterized by a contact angle of ?
485,theta < 90 degrees,    What  drainage shape has the largest shape factor CA of 31.62?
486,Cylinder,    This k-factor often used in reservoir engineering applications relates particle energy to temperature and is named after this Austrian physicist.
